"global_category","indicator_name","value","count"
"Overview","Non-GHG target","No top-line target.<br>Some sectoral non-GHG target:<br>""Introduction of enabling frameworks for the modernization of the private vehicle fleet (substitution by hybrid and 100% electric vehicles)""<br>""Low-carbon and resilient development of small cocoa producers, intervention of 146,648 Ha, with a reduction potential of 2.2 MM tCO2eq, in a period of 10 years.""<br>""Reduction of emissions in the cultivation of rice at the national level through the change of production technology, in 30,000 ha in a period of 30 years.""",1
"Overview","Non-GHG target","Not Specified.<br>""100% renewable energy"" in 2050 long-term low greenhouse gas emission, climate-resilient development strategy mentioned.",1
"Overview","Non-GHG target","See Uruguay's full NDC submission on Main mitigation measures being implemented and to be implemented to contribute to achieving unconditional and conditional objectives for sectoral targets in Energy, transport, agriculture, LULUCF, waste, etc.",1
"Overview","Non-GHG target","Tonga commits to targets and measures in energy, AFOLU and waste sector. Please refer to ""table 1. Mitigation targets, means and requirements"" in the original text for more information.<br>""Energy: 70% of electricity generated from renewable sources by 2030 through combination of solar, wind and battery storage"";<br>""AFOLU: non-emission targets of establishing a forest inventory as prerequisite to identify a GHG emission target for the 2025 NDC and planting one million trees by 2023"";<br>""Waste: non-emission target of expanding the formal waste collection system as prerequisite to identify a GHG emission target for the 2025 NDC.""",1
"Overview","Non-GHG target","Unconditional targets<br><ul ><li>18% of the power demand (i.e. electricity demand) and 11% of the heat demand (in the building sector) in 2030 is generated by renewable energy sources. </li><li>A 3% reduction in power demand through energy-efficiency measures in 2030 compared to the demand under the BAU scenario. </li><br>Conditional targets<br><ul<li>30% of the power demand (i.e. electricity demand) and 16.5% of the heat demand (in the building sector) in 2030 is generated by renewable energy sources.</li><li>A 10% reduction in power demand through energy-efficiency in 2030 compared to the demand under the BAU scenario.</li></ul>",1
