"global_category","indicator_name","value","count"
"Overview","Non-GHG target","<p>Bangladesh&rsquo;s strategy on mitigation is set out in the Bangladesh Climate Change Strategy and Action Plan (BBCSAP). This sets out seven programs on mitigation. One of these programs is renewable energy development with the objective of &ldquo;maximizing the use of renewable energy sources to lower GHG emission and ensuring energy security.&rdquo; Bangladesh also sets out &ldquo;additional mitigation actions&rdquo; in its INDC in order to meet its conditional contribution. Some of these actions include the development of &ldquo;400 MW of wind-generating capacity by 2030,&rdquo; and &ldquo;1000 MW of utility-scale solar power plant by 2030.&rdquo;</p>",2
"Overview","Non-GHG target","<p>Bosnia and Herzegovina outlines the following mitigation activities in its INDC: &ldquo;to install mini hydro power plants with the power generation capacity of up to 10 MW and the total generation capacity of 120 MW, by 2030; to install wind farms of the power generation capacity of 175 MW by 2030; to install photovoltaic modules of the total power generation capacity of 4 MW by 2030; and to introduce renewable energy sources in the existing district heating systems and to construct new district heating systems fuel led by renewable energy sources.&rdquo;</p>",2
"Overview","Non-GHG target","<p>Chad communicates a summary of the projects to be implemented under the INDC, which include the generation of 500 GWh/year of hydropower, 200 GWh/year of solar energy, and 50 GWh/year of wind energy.</p>",2
"Overview","Non-GHG target","<p>Djibouti communicates the following unconditional mitigation actions:<br />&ldquo;Installation of 60 MW onshore wind turbines in Goubet. Those power plants are scheduled to be commissioned in 2025.&rdquo;<br />&ldquo;Installation of three solar power plants in Petit Bara, Ali Sabieh and Goubet, with an estimated photovoltaic potential of 250 MW. Those power plants are scheduled to be commissioned in 2025.&rdquo;<br />&ldquo;Exploitation of geothermal energy, whose potential is estimated at 1200 MW in the region around Lake Assal, Lake Abb&eacute;, and North Goubet. The power plants are scheduled to be commissioned in 2030.&rdquo;</p> <p>Djibouti further communicates the following secondary mitigation measures that are under study and awaiting financing: &ldquo;Combined production plant for electricity using household waste. Supposed potential of 10 MW.&rdquo;<br />&ldquo;Energy production using tidal turbines in Goubet. Supposed potential of 5 MW.&rdquo;<br />&ldquo;Djibouti&rsquo;s total wind power potential is estimated at 390 MW. Installation of 11 onshore wind turbines in Goubet, producing 30 MW.&rdquo;</p>",2
"Overview","Non-GHG target","<p>In the energy sector, Swaziland&rsquo;s contribution &ldquo;is to double the share of renewable energy in the national energy mix by 2030 relative to 2010 levels.&rdquo;</p>",2
"Overview","Non-GHG target","<p>Jordan has set a KPI-style &ldquo;target&rdquo; of 11% of renewable energy share in the total energy mix in 2025.This KPI is articulated in &ldquo;Jordan 2025: A National Vision and Strategy&rdquo; (launched June 2015). Additionally, the main goals of Jordan&rsquo;s strategy are &ldquo;to secure reliable energy supply through increasing the share of local energy resources such as oil shale and natural gas in the energy mix, expanding the development of renewable energy projects, promoting energy conservation and energy efficiency and awareness, and generating electricity from nuclear energy.&rdquo;</p>",2
"Overview","Non-GHG target","<p>Mongolia&rsquo;s policies and measures for implementation up to 2030 include: &ldquo;increase renewable electricity capacity from 7.62% in 2014 to 20% by 2020 and to 30% by 2030 as a share of total electricity generation capacity.&rdquo;</p>",2
"Overview","Non-GHG target","<p>Myanmar&rsquo;s INDC includes the following mitigation actions:<br />&ldquo;Increase the share of hydroelectric generation within limits of technical Hydroelectric potential. Indicative goal: 9.4 GW by 2030.&rdquo;<br />&ldquo;To increase access to clean sources of electricity among communities and households currently without access to an electric power grid system. Indicative goal: Rural electrification through the use of at least 30% renewable sources to generate electricity supplies.&rdquo;</p>",2
"Overview","Non-GHG target","<p>Non-GHG targets include:</p><p>- Raising the share of renewable energy to at least 30% of electricity production;</p><p>- Improving energy efficiency by at least 20% by 2030;</p><p>- Increasing biofuel use in transport to 5% by 2030; and</p><p>- Capturing and utilising landfill gas.</p>",2
"Overview","Non-GHG target","<p>The Central African Republic communicates conditional mitigation measures that include the: &ldquo;construction of a photovoltaic solar power plant at Bangu; development of 180 MW Dimoli hydroelectric plant; development of 72 MW Lobaye hydroelectric plant; development of 60 KW La Kotto hydroelectric plant; development of Mobaye hydroelectric plant; and a National Biofuels Programme.&rdquo;</p>",2
"Overview","Non-GHG target","<p>The Solomon Islands communicate mitigation actions that involve the commissioning of hydropower, solar, and geothermal plants. Anticipated installed capacities are as follows: hydropower 3.77 MW, solar 3.2 MW, and geothermal 20&ndash;40 MW.</p>",2
"Overview","Non-GHG target","<p>The UAE has set a target of increasing clean energy contribution to the total energy mix from 0.2% in 2014, to 24% by 2021. This will be achieved through renewable and nuclear energy, and is underpinned by detailed emirate level targets and policies.</p>",2
"Overview","Non-GHG target","<p>Uganda communicates policies and measures for the mitigation contribution, including &ldquo;achieving a total of at least 3,200 MW renewable electricity generation capacity by 2030, up from 729 MW in 2013.&rdquo;</p>",2
"Overview","Non-GHG target","<p>Unconditional commitment: &ldquo;With regard to energy, actions are promoted with a focus on mitigation and adaptation to climate change and holistic development, achieving the following results&hellip;increased participation of renewable energy to 79% by 2030 from 39% in 2010&hellip;and&hellip;develop the export potential of electricity, generated mainly by renewable energies, reaching to export an estimated 8,930 MW by 2030, increasing energy state income.&rdquo; To achieve results related to energy the following measures and actions will be promoted: &ldquo;Change and diversification of the energy matrix with renewable energy growth through the construction of hydropower (small and medium hydro power plants, large hydro and multipurpose) and boost alternative energy (wind, biomass, geothermal and solar), and use other sources of energy (steam combined cycle)&hellip;and promotion of energy surplus export from renewable sources, positioning Bolivia as a regional powerhouse with clean energy.&rdquo; Conditional commitment: &ldquo;Increased participation of renewable energy to 81% by 2030, compared to 39% in 2010.&rdquo;</p>",2
"Overview","Non-GHG target","<p>Unconditional objective</p> <p>""Under the National Reforestation Programme, Burundi has undertaken to increase its carbon dioxide gas well through 4,000 hectares of annual reforestation over the course of 15 years, beginning in 2016.</p> <p>In the energy sector, Burundi is in the process of building three hydroelectric power plants. This programme will increase the country&rsquo;s electrification rate to 35%.""</p> <p>Conditional objective</p> <p>""- Forestry:(i) reforestation of 8,000 ha/year during 15 years, beginning in 2016; (ii) replacement of 100% of traditional charcoal kilns and traditional home ovens by 2030;</p> <p>- Agriculture: gradual replacement of 100% of mineral fertilizers with organic fertilizer by 2030.""</p>",2
"Overview","Non-GHG target","<p>Unconditional target</p> <ul> <li>""15% of the power and heat demand in 2030 is generated by renewable energy sources.</li> <li>A 3% reduction in power demand through energy-efficiency measures in 2030 compared to the demand under the Business-As-Usual scenario.""</li> </ul> <p>Conditional target</p> <ul> <li>""20% of the power and heat demand in 2030 is generated by renewable energy sources.</li> <li>A 10% reduction in power demand through energy-efficiency in 2030 compared to the demand under the BAU scenario.""</li> </ul>",2
"Overview","Non-GHG target","<ul> <li>""Strongly support CO<sub>2</sub> reduction in the Borjomi-Bakuriani Forest district by at least 70% between 2020 and 2030;</li> <li>Implement afforestation/reforestation activities on already identified 1,500 ha of degraded lands by 2030;</li> <li>Assist natural regeneration of forests through different silvicultural methods on 7,500 ha by 2030 in order to restore natural forest cover.""</li> </ul> <p>&nbsp;</p>",2
"Overview","Non-GHG target","<ul> <li>45% Renewable Energy target by 2025</li> <li>35% Energy Efficiency target by 2025</li> </ul>",2
"Overview","Non-GHG target","<ul> <li>50% of electricity generation from renewable sources by 2020. In 2015 renewable energy accounts for approximately 9% of total electricity generation, with confirmed and funded investments taking this to 13% in 2016.</li> <li>70% of electricity generation from renewable sources by 2030</li> <li>Improve Energy efficiency through reduction of electricity line losses to 9 percent by 2020 (from a baseline of 18 percent in 2010)</li> </ul>",2
"Overview","Non-GHG target","<ul> <li>To increase forest cover to 70% of land area (i.e. to 16.58 million hectares) by 2020.</li> <li>To increase the share of renewable energy to 30% of energy consumption by 2025.</li> <li>To make electricity available to 90% of households in rural area by the year 2020.</li> </ul><p>&ldquo;Implementation of Renewable Energy Development Strategy: To increase the share of renewable energy to 30% of energy consumption by 2025. (Note that large-scale technologies with installed capacity equal to or greater than 15 MW are not included in this policy&rsquo;s target.) For transport fuels the objective is to increase the share of biofuels to meet 10% of the demand for transport fuels by 2025.&rdquo;</p> <p>&ldquo;Expansion of the use of large-scale hydroelectricity: The objective of this activity is to build large-scale (&gt;15 MW) hydropower plants to provide clean electricity to neighboring countries. Approximate total installed capacity of the hydropower plants will be 5,500 MW by 2020. In addition, 20,000 MW of additional hydroelectric capacity is planned for construction after 2020.&rdquo;</p>",2
"Overview","Non-GHG target","Development of renewable energies (target of 4% of the energy mix).",2
"Overview","Non-GHG target","Forest cover will increase to the level of 45% by 2030.",2
"Overview","Non-GHG target","Increase the share of non-fossil fuels in primary energy consumption to around 20% and ""increase the forest stock volume by around 4.5 billion cubic meters on the 2005 level"". China has included other goals that include the development of &ldquo;nuclear power in a safe and efficient manner.&rdquo;",2
"Overview","Non-GHG target","Integration of renewable energy in the power system of the Sudan, target of 20% by 2030<br />""25% forest coverage from the total area of the Sudan by 2030""",2
"Overview","Non-GHG target","Produce 30% of its energy (excluding wood-energy) from renewable energy sources (SE4ALL)",2
"Overview","Non-GHG target","Renewable energy target<br>""Sur cette base, le Gabon a d&eacute;velopp&eacute; un plan ambitieux de d&eacute;veloppement de l&rsquo;hydro&eacute;lectricit&eacute;, avec comme objectif d&rsquo;assurer &agrave; horizon 2025 une fourniture de l&rsquo;&eacute;lectricit&eacute; bas&eacute;e &agrave; 80% sur l&rsquo;hydro&eacute;lectricit&eacute; et 20% sur le gaz.""<br> On this basis, Gabon has developed an ambitious plan for the development of hydropower, with aims to ensure that by 2025, 80% of the supply of electricity is based on hydropower and 20% on gas.<br>(Note: The Non-GHG target is not analyzed for other indicators as very little information was provided.)",2
"Overview","Non-GHG target","""By 2030, Armenia is going to double its share of renewables in energy generation on the path to achieve climate neutrality in the second half of this century.""<br>""Armenia is developing solar energy capacity from current 59.57 MW to 1000 MW before 2030, to increase both, green energy share and energy security (at least 15 percent in 2030 in power generation mix);""<br>""increase of forest cover to 12.9 percent of the territory of Armenia by 2030;""",1
"Overview","Non-GHG target","""Cabo Verde undertakes to reduce energy demand by 7% below BAU projections through change in the energy mix and energy efficiency improvements. With adequate support, the reduction commitment can be increased to 15% below BAU projections.""<br>""Cabo Verde undertakes to make a major shift towards the low-carbon economy by increasing the RE share in the electricity supply (today at 18.4%) to 30% (in 2025) and up to 50% in 2030.""<br>""Cabo Verde undertakes to electrify at least 25% of its land-borne transport fleet (new vehicles) by 2030 by resorting to RE sources. Conditional on adequate international support, the shares per vehicle category could increase to 50% in favor of public, collective high-passenger load vehicles.""<br>""Cabo Verde undertakes to strengthen sustainable tourism as a factor for local empowerment and economic development, ensuring climate resilience and diversification and increasing decent employment. International and national efforts combined seek to reduce overall GHG emissions from tourism by 20% per visitor/day by 2030.""<br>Please see the ""mitigation contributions"" in the full text for more detailed sectoral non-GHG targets.",1
"Overview","Non-GHG target","""halving the deforestation rate by 2030""",1
"Overview","Non-GHG target","""Increase to 24% of electricity generation based on Renewable Energy Sources (RES) in the Cuban electricity matrix by 2030."" <br>""Increase of forest coverage in the country to 33% by 2030"" <br>""The installation of 833,333 units of solar heaters (One million of square meters of catchment area) in the residential and industrial sectors by 2030."" <br>""The installation of 15 million 250 thousand LED lamps in the residential and public sector by 2030.""<br>""The replacement of 2 million electric resistance cookers by induction cookers by 2030."" <br>""The installation of 5,000 solar pumping systems in livestock by 2030."" <br>""Reduction of the consumption of fossil fuels in vehicles terrestrial by 50% by 2030."" <br>""Treatment of 100% of wastewaters in the Cuban swine sector.""",1
"Overview","Non-GHG target","""Panama is committed to the forest restoration of 50,000 ha nationwide, which will contribute to the carbon absorption of approximately 2.6 Million tons of CO 2 2eq by the year 2050.""",1
"Overview","Non-GHG target","""The enhanced NDC is coherent with the following sectoral non-GHG targets in 2030 stipulated in the draft National Energy and Climate Plan (NECP):<br>Renewable Energy Sources (RES)<ul><li>38% share in gross final energy consumption</li><li>66% share in gross electricity production</li><li>45% share in gross final energy consumption for heating and cooling</li><li>10% in final energy consumption in transport</li></ul><br>Energy Efficiency (EE)<ul><li>20.8% savings of final energy consumption relative to BAU scenario</li><li>34.5% savings of primary energy consumptionrelative to BAU scenario""</li></ul>",1
"Overview","Non-GHG target","""The United States has set a goal to reach 100 percent carbon pollution-free electricity by 2035""",1
"Overview","Non-GHG target","""to reach close to 100% renewable energy power generation (grid-connected) by 2030<br>""to reduce energy sector CO2 emissions by 10% through energy efficiency improvements economy-wide, implicitly in the transport, industry, and electricity demand-side sub-sectors.""<br>""to reduce domestic maritime shipping emissions by 40%.""",1
"Overview","Non-GHG target","<br>Energy<br> Energy Industry (Electricity Generation)<br><ul><li> By 2030, Renewable Energy Capacity Addition and substituting (replacement) of fossil fuels with Coconut (Copra) Oil based Electricity Generation: transitioning to close to 100% renewable energy in the electricity generation sector.</li></ul><br> Transport<br><ul><li> By 2030, 10% improvement in transport (land and marine) energy efficiency</li><li> Electric Vehicles (e-Mobility): by 2030, (a) Introduce Electric Vehicles (e-buses) for public transportation (10% of total Public Buses); (b) Introduce Electric Cars (e-Cars) in Vanuatu (10% of government fleet); and (c) 1000 Electric Two wheelers (e-bikes) /Three Wheelers (e-rickshaw)</li><li> By 2030, 20 % Bio-diesel (bio-fuel) Blending in Diesel</li><li> By 2030, Milage and Emission Standards for Vehicles</li></ul><br> Other Sectors - Commercial, Institutional and Residential<br><ul><li> By 2030, (a) 100% electricity access by households in off-grid areas; (b) 100% electricity access by public institutions (on- and off-grid); (c) 13% electricity sector end-use efficiency; (d) 14% improve biomass end use (improved cook stoves and drying) efficiency; (e) 65% renewable electricity use by rural tourism bungalows.</li><li> By 2030, installation of 1000 numbers of Biogas Plants for Commercial and Residential Use</li><li> By 2030, Increase Energy Efficiency in Commercial and Residential Sector, (a) 5% increase in Energy Efficiency in Commercial and Residential Sector; and (b) 10 Numbers of Energy Efficient Building (Green Building)</li><li> By 2030, Increase Ecotourism Supported by Local Communities</li></ul><br>AFOLU<br>Livestock<br><ul><li> By 2030, Training and capacity building for livestock farming and pasture management</li><li> By 2030, Converting Pastures to Silvopastural Livestock Systems</li><li> By 2030, International Collaboration to Improve Livestock Efficiency</li></ul><br>Forestry<br><ul><li> The forestry sector in Vanuatu is a net carbon sink.</li><li> Sustainable logging practices are being practiced in Vanuatu for commercial logging.</li><li> Vanuatu is committed to maintaining its forest cover in the country and is expected to remain net carbon negative in future as well. The REDD+ programme is currently being implemented in Vanuatu to improve sustainable forest management practices.</li></ul><br>Waste<br> Solid Waste (Municipal Solid Waste)<ul><li>By 2030, Implement Waste to Energy Plant for Municipal Solid Waste (MSW): (a) Waste to Energy Plant for Port Villa; (b) Waste to Energy Plant for Luganville; and (c) Waste to Energy Plant for Lenakel.</li><li>By 2030, Introduce Composting for municipal organic waste to produce soil enhancer</li><li>By 2030, Implement Collect, Sort and Export of Recyclable Materials (first phase) for Port Vila</li><li>By 2030, Develop and Implement National Plastics Strategy</li></ul><br>Waste Water<br><ul><li>By 2030, Implement Waste Water Management System in Vanuatu: (a) Centralised Waste water collection and treatment system in municipal area including awareness and capacity building</li><li>By 2030, Improvements to Public and Communal Toilet Facilities including Bio- Toilets”</li></ul>",1
"Overview","Non-GHG target","<p class=""Default"">&ldquo;La mise en oeuvre des mesures envisag&eacute;es pourraient &eacute;galement contribuer &agrave; accroitre la capacit&eacute; de s&eacute;questration cumul&eacute;e du B&eacute;nin par rapport au sc&eacute;nario de maintien du statu quo de 5,7 % sur la p&eacute;riode 2021-2030 &agrave; travers la r&eacute;duction du taux annuel de d&eacute;forestation des for&ecirc;ts naturelles de 41,7 %. Au titre de cet objectif, la contribution inconditionnelle est de l&rsquo;ordre de 1,4 % et la contribution conditionnelle est d&rsquo;environ 4,3%.&rdquo;</p> <p>The implementation of the proposed measures could also help increase Benin&rsquo;s total sequestration capacity by 5.7% relative to the baseline scenario between 2021 and 2030, by reducing the annual rate of deforestation by 41.7%. The unconditional contribution for this target is around 1.4% and conditional contribution is about 4.3%.&nbsp;</p><p>[Unofficial translation] Benin communicates the following mitigation measures in the energy sector: To promote the use of renewable energy in electricity production from (i) dual-fired power plants (totaling 400 MW) (ii) four hydropower plants (totaling 396.6 MW installed capacity) and (iii) solar photovoltaic plants (totaling 54.2 MW installed capacity).</p>",1
"Overview","Non-GHG target","<p>""Current forest cover in Sri Lanka is 29.6% and is planned to be increased to 32%. This includes management of mangrove and wetland ecosystems, management and conservation of natural forests, restoration of degraded forests in underutilized lands and urban forestry.""</p>",1
"Overview","Non-GHG target","<p>""Esta empresa ha implementado en la Reserva Forestal Imataca el Plan de Manejo Forestal Sustentable Reserva Forestal Imataca (RFI), Unidad de Manejo Imataca V, cuyos resultados se resumen a continuaci&oacute;n:</p> <ul> <li>Implantaci&oacute;n del nuevo modelo de producci&oacute;n forestal en una superficie de 166350 ha, con posibilidad de expandirse a un mill&oacute;n de hect&aacute;reas.</li> <li>De acuerdo con Estimaciones realizadas por ENAFOR, para un &aacute;rea de 200.000 ha de bosques intervenidos y no intervenidos en la RFI (Unidades III y V), el carbono almacenado en los mismos equivale a 159 ton/ha, lo que da como resultado para esa superficie un total de 31.800.000 ton de C (116.388.000 t CO<sub><span>2</span></sub>eq), como l&iacute;nea base. Con la aplicaci&oacute;n del nuevo Modelo de Manejo Forestal aplicando la Normas T&eacute;cnicas y Legales, es estim&oacute; como Emisiones evitadas directas: 1.136.759,35 tCO<sub>2</sub>eq para los 5 a&ntilde;os del proyecto en 25.000 ha (227.351 tCO<sub>2</sub>eq para 5.000 ha/a&ntilde;o) y emisiones evitadas indirectas: 18.188.149 tCO<sub>2</sub>eq para los 5 a&ntilde;os del proyecto (3.637.629CO<sub>2</sub>eq por a&ntilde;o en 80.000 ha). Como l&iacute;nea base se&nbsp;estima una p&eacute;rdida de 453.135 ton/a&ntilde;o CO<sub>2</sub>eq por uso de t&eacute;cnicas forestales convencionales para un &aacute;rea de aprovechamiento de 5.000 ha/a&ntilde;o.</li> <li>ENAFOR, ha producido 200.000 plantas de las cuales el 60% (120.000) han sido donadas para su plantaci&oacute;n por las misiones Arb&oacute;l y Vivienda, esto equivale a una superficie cercana 100 ha. Las restantes (80,000) han sido plantadas por ENAFOR para una superficie equivalente de 50 ha. Se han incorporado comunidades a las diferentes actividades del Manejo Forestal Sustentable. Estas actividades Involucran: Agroforester&iacute;a, mediciones de &aacute;rboles, Piqueros, Viveristas, y desarrollo Social""</li> </ul> <p>This company [Socialist National Forestry Company (ENAFOR)]&nbsp;has implemented the Imataca Forest Reserve on Sustainable Forest Management Plan Imataca Forest Reserve (RFI) Imataca Management Unit V, whose results are summarized below:</p> <ul> <li>Implementation of the new model of forestry production in an area of 166,350 ha, with possibility to expand to one million hectares.</li> <li>According to estimates by ENAFOR, for an area of 200,000 hectares of logged forests not operated in the RFI (Units III and V), the carbon stored in them is equivalent to 159 tonnes / ha, which results for that area totaling 31.8 million tons of C (116,388,000 t CO<sub>2</sub> eq) as the base line. With the implementation of the new Forest Management Model applying technical and legal standards, it is considered as direct emissions avoided: 1,136,759.35 tCO<sub>2</sub>eq for the 5-year project on 25,000 ha (227,351 tCO<sub>2</sub>eq to5,000 ha / year) and&nbsp;indirect&nbsp;emissions&nbsp;avoided: 18,188,149 tCO<sub>2</sub>eq for the 5-year project (3.637.629CO<sub>2</sub>eq per year in 80,000 ha). As a baseline loss of 453,135 ton /year CO<sub>2</sub>e by using conventional techniques for forest harvest area of 5,000 ha / year it is estimated.</li> <li>ENAFOR has produced 200,000 plants of which 60% (120,000) have been donated to tree planting by quests and Housing, this amounts to a nearby 100 ha. The remaining (80,000) have been planted by ENAFOR for an equivalent area of 50 ha. Communities have joined the various activities of SFM. These activities involve: Agroforestry, tree measurements, Piqueros, Nurseries and Social Development ""</li> </ul>",1
"Overview","Non-GHG target","<p>""Reduction of fuel wood consumptio-by 27% - 66%"";</p><p>""85% renewable energy by 2030 by implementing hydropower, solar, wind and biomass, and reduction of transmission and distribution losses.""</p> <p>Aim is to achieve at least a 20% reduction in conventional transportation fuel use by 2030 and promote energy efficiency in the transport sector through appropriate policies and investments.</p>",1
"Overview","Non-GHG target","<p>&ldquo;Belize expects to increase its share of its renewable energy (RE) in Belize&rsquo;s electricity mix by 85% by 2027.&rdquo;</p>",1
"Overview","Non-GHG target","<p>&ldquo;Eritrea intends to raise the share of electricity generation from renewable energy to 70% of the total electricity generation mix (wind, solar, and geothermal) [by 2030].&rdquo;</p>",1
"Overview","Non-GHG target","<p>&ldquo;Increase renewable energy sources by 200 MW by 2020: 40 MW from solar (2017/2018); 35 MW from wind (2017); 125 MW from hydropower (2025).&rdquo;</p>",1
