"global_category","indicator_name","value","count"
"Overview","Non-GHG target","<p>&ldquo;Morocco has set a target to limit greenhouse gas (GHG) growth that will be reached through its own means, a target that could be enhanced substantially with support from the international community. This ambition rests, to a large extent; on a major transformation of the energy sector...The main objectives behind this transformation are...Reaching over 50% of installed electricity production capacity from renewable sources by 2025.&rdquo;</p>",1
"Overview","Non-GHG target","<p>&ldquo;Plans and policies to be implemented for this INDC: Increasing capacity of production of electricity from solar power to 10 GW until 2030; increasing capacity of production of electricity from wind power to 16 GW until 2030; commissioning a new nuclear plant, and tapping the full hydroelectric potential.&rdquo;</p>",1
"Overview","Non-GHG target","<p>&ldquo;We are making progress towards reaching our target of 90 percent of electricity coming from renewable sources by 2025.&rdquo;</p>",1
"Overview","Non-GHG target","<p><strong>Energy Sector: </strong></p><p>Energy sector has a 20% GHG emission reduction target in the NDCs, which amounts to 39,383Gg of the total GHG emissions (196,915Gg for the period 2020-2030 as per the BAU scenario of the Long Term Generation Expansion Plan 2013-2032 published in October 2013). The reduction of emissions includes 4% (9,173Gg) unconditional and 16% (30,210Gg) conditional reduction.</p><p>The NDCs for the energy sector include:</p><ul><li>NDC 1: Establishment of large scale wind power plants of 514 MW &nbsp;</li><li>NDC 2: Establishment of 115 MW of solar power plants</li><li>NDC 3: Establishment of 105 MW of biomass power plants</li><li>NDC 4: Establishment of 176 MW of mini hydro power plants</li><li>NDC 5: Introduction of Demand Side Management (DSM) activities</li><li>NDC 6: Strengthening sustainable energy related policies with a view to increasing the share of renewable energy from the existing 50%, to 60% in 2020. (The level of 60% expected to be reached in 2020 will be maintained at the same level, until further developments in renewable energy technology allow for increased share of electricity generation from the renewable energy sources.)</li><li>NDC 7: Converting existing fuel oil based power plants to LNG (newly proposed INDC)</li></ul><p>&nbsp;</p><p><strong>Forestry Sector: </strong></p><p>Increase the forest cover of Sri Lanka from 29% to 32% by 2030.</p>",1
"Overview","Non-GHG target","<p>Energy sector: ""Improving energy efficiency by 20% by 2020; Increasing access to clean energy by 35% in 2015, 40% in 2020 and 50% by 2030; With increase in rural electrification, paraffin consumption is expected to come down from 30, 434 kilolitres (2014) to 25,000 kilolitres in 2020, and 20,000 kilolitres in 2030; Reduce transmission and distribution losses from 12% in 2015 to 7.5% by 2030 (0.5% per annum)""</p><p>Building sector: ""To disseminate efficient stoves to reach a penetration rate of 30% in 2030; To reduce progressively the use of wood for heating in order to reach 10% by 2030; Replacement of fuel-wood with LPG at the rate of 10% a year from 2020 to 2030.""</p><p>Agriculture sector: ""Gradual replacement of 100% of mineral fertilizers with organic fertilizers by 2030.""</p>",1
"Overview","Non-GHG target","<p>Energy sector: to reduce total energy consumption by 63% by 2035 compared to a Business-AsUsual (BAU) scenario; and to increase the share of renewables so that 10% of the total power generation is sourced from renewable energy by 2035</p> <p>Forestry sector: to increase the total gazette forest reserves to 55% of total land area, compared to the current levels of 41%.""</p>",1
"Overview","Non-GHG target","<p>Esta empresa ha implementado en la <strong>Reserva Forestal Imataca (RFI) el Plan de Manejo Forestal Sustentable de la unidad de Manejo Imataca V</strong>, cuyos resultados se resumen a continuaci&oacute;n:</p><ul><li>Implantaci&oacute;n del nuevo modelo de producci&oacute;n forestal en una superficie de ciento sesenta y seis mil trescientas cincuenta hect&aacute;reas (166.350 ha), con posibilidad de expandirse a un mill&oacute;n de hect&aacute;reas (1.000.000ha).</li><li>De acuerdo con las estimaciones realizadas por ENAFOR, para un &aacute;rea de 200.000 ha de bosques intervenidos y no intervenidos en la RFI (Unidades III y V), el carbono almacenado en los mismos equivale a 159 ton/ha, lo que da como resultado para esa superficie un total de 31.800.000 ton de C (116.388.000 tCO<sub>2</sub>eq), como l&iacute;nea base. Con la aplicaci&oacute;n del nuevo Modelo de Manejo Forestal aplicando las Normas T&eacute;cnicas y Legales, se estim&oacute; como Emisiones evitadas directas: 1.136.759,35 tCO<sub>2</sub>eq para los 5 a&ntilde;os del proyecto en 000 ha (227.351 tCO<sub>2</sub>eq para 5.000 ha/a&ntilde;o) yemisiones evitadas indirectas: 18.188.149 tCO<sub>2</sub>eq para los 5 a&ntilde;os del proyecto (3.637.629CO<sub>2</sub>eq por a&ntilde;o en 80.000ha). Como l&iacute;nea base se estima una p&eacute;rdida de 453.135 ton/a&ntilde;oCO<sub>2</sub>eq por uso de t&eacute;cnicas forestales convencionales para un &aacute;rea de aprovechamiento de 5.000 ha/a&ntilde;o.</li><li>ENAFOR, ha producido doscientas mil (200.000) plantas de las cuales el 60% ciento veinte mil (120.000) han sido donadas para su plantaci&oacute;n por las misiones &Aacute;rbol y Vivienda, esto equivale a una superficie cercana cien hect&aacute;reas (100 ha). Las restantes ochenta mil hect&aacute;reas (80.000ha) han sido plantadas por ENAFOR para una superficie equivalente de cincuenta hect&aacute;reas (50 ha). Se han incorporado comunidades a las diferentes actividades del Manejo Forestal Sustentable, tales como: agroforester&iacute;a, mediciones de &aacute;rboles, piqueros, viveristas, y desarrollo social.</li></ul><p> </p><p>This company has implemented in the <strong>Imataca Forest Reserve (RFI) the Sustainable Forest Management Plan of the Imataca V Management Unit</strong>, whose results are summarized below:</p><ul><li>Implementation of the new model of forest production in an area of one hundred sixty-six thousand three hundred and fifty hectares (166,350 ha), with the possibility of expanding to one million hectares (1,000,000ha).</li><li>According to the estimates made by ENAFOR, for an area of 200,000 ha of forests intervened and not intervened in the RFI (Units III and V), the carbon stored in them is equivalent to 159 ton / ha, which results in that area a total of 31,800,000 tons of C (116,388,000 tCO<sub>2</sub>eq), as the baseline. With the application of the new Forest Management Model applying the Technical and Legal Standards, it was estimated as direct avoided emissions: 1,136,759.35 tCO <sub>2</sub> eq for the 5 years of the project in 000 ha (227,351 tCO<sub>2</sub>eq for 5,000 ha / year ) indirect avoided emissions: 18,188,149 tCO<sub>2</sub>eq for the 5 years of the project (3,637,629 CO<sub>2)</sub>eq per year at 80,000ha). As a baseline, a loss of 453,135 ton / year CO<sub>2</sub>eq is estimated due to the use of conventional forestry techniques for an area of 5,000 ha / year.</li><li>ENAFOR, has produced two hundred thousand (200,000) plants of which 60% one hundred twenty thousand (120,000) have been donated for planting by the Tree and Housing missions, this amounts to a surface close to one hundred hectares (100 ha). The remaining eighty thousand hectares (80,000ha) have been planted by ENAFOR for an equivalent surface of fifty hectares (50 ha). Communities have been incorporated into the different activities of Sustainable Forest Management, such as: agroforestry, tree measurements, piqueros, nurserymen, and social development.</li>",1
"Overview","Non-GHG target","<p>In energy sector, Indonesia has embarked on a mixed energy use policy, the primary energy supply mix with shares as follows:</p><p>a) new and renewable energy at least 23% in 2025 and at least 31% in 2050;</p><p>b) oil should be less than 25% in 2025 and less than 20% in 2050;</p><p>c) coal should be minimum 30% in 2025 and minimum 25% in 2050; and</p><p>d) gas should be minimum 22% in 2025 and minimum 24% in 2050.",1
"Overview","Non-GHG target","<p>Morocco&rsquo;s GHG mitigation goals rely in large part on an important transformation of the country&rsquo;s energy sector. This transformation is driven by great political will. It aims to reduce the country&rsquo;s heavy reliance on foreign energy sources and increase the share of renewable energy, while responding to growing demand for energy to ensure the socioeconomic development and well-being of its citizens. The primary goals that underlie this energy transition are the following:</p><p>&nbsp;</p><ul><li>Reaching over 52 % of installed electricity production capacity from renewable sources by 2030.</li><li>Reducing energy consumption by 15 % by 2030.</li><li>Substantially reducing public fossil fuel subsidies, building on reforms already undertaken in recent years.</li><li>Substantially increasing the use of natural gas, through infrastructure projects allowing liquefied natural gas imports.</li></ul>",1
"Overview","Non-GHG target","<p>Thanks to the ongoing structural transformation of the power generation mix, by 2017, Uruguay will achieve an absolute emissions reduction of 88% within this subsector compared to the annual average for the period 2005&ndash;2009, with a higher consumption&hellip;This will be achieved with 40% of non-conventional renewable energy sources (mainly wind, but also photovoltaic and biomass waste), in addition to 55% hydropower (estimating an average annual rainfall). Although this figure would increase in the following decades after reaching the hydro-wind complementation threshold, it could remain close to 2017 value, if storage systems were to be incorporated through additional means of implementation&hellip;&rdquo;</p>",1
"Overview","Non-GHG target","<ul> <li>""By 2050, Nepal will achieve 80% electrification through renewable energy sources having appropriate energy mix. Nepal will also reduce its dependency on fossil fuels by 50%.</li> <li>Nepal aims to achieve the following target under the National Rural and Renewable Energy Programme (NRREP), reducing its dependency on biomass and making it more efficient. <table style=""width: 100%;"" border=""1"" cellspacing=""0"" cellpadding=""0""> <tbody> <tr> <td valign=""top"" width=""47%""> <p><strong>Technologies</strong></p> </td> <td valign=""top"" width=""52%""> <p><strong>Targets</strong></p> </td> </tr> <tr> <td valign=""top"" width=""47%""> <p>Mini and Micro Hydro Power</p> </td> <td valign=""top"" width=""52%""> <p>25 MW</p> </td> </tr> <tr> <td valign=""top"" width=""47%""> <p>Solar Home System</p> </td> <td valign=""top"" width=""52%""> <p>600,000 systems</p> </td> </tr> <tr> <td valign=""top"" width=""47%""> <p>Institutional solar power systems (solar PV and solar pumping systems)</p> </td> <td valign=""top"" width=""52%""> <p>1,500 systems</p> </td> </tr> <tr> <td valign=""top"" width=""47%""> <p>Improved water mill</p> </td> <td valign=""top"" width=""52%""> <p>4,000 number</p> </td> </tr> <tr> <td valign=""top"" width=""47%""> <p>Improved Cooking Stoves</p> </td> <td valign=""top"" width=""52%""> <p>475,000 stoves</p> </td> </tr> <tr> <td valign=""top"" width=""47%""> <p>Biogas</p> </td> <td valign=""top"" width=""52%""> <p>130,000 household systems, 1,000 institutional and 200 community biogas plants</p> </td> </tr> </tbody> </table> </li> <li>Nepal will maintain 40% of the total area of the country under forest cover and forest productivity and products will be increased through sustainable management of forests. Emphasis will equally be given to enhance carbon sequestration and forest carbon storage and improve forest governance.""</li> </ul>",1
"Overview","Non-GHG target","<ul> <li>""By 2050, Nepal will achieve 80% electrification through renewable energy sources having appropriate energy mix. Nepal will also reduce its dependency on fossil fuels by 50%.</li> <li>Nepal aims to achieve the following target under the National Rural and Renewable Energy Programme (NRREP), reducing its dependency on biomass and making it more efficient. <table><thead><tr><th>Technologies</th><th>Targets</th></tr></thead><tbody><tr><td>Mini and Micro Hydro Power</td><td>25 MW</td></tr><tr><td>Solar Home System</td><td>600,000 systems</td></tr><tr><td>Institutional solar power systems (solar PV and solar pumping systems)</td><td>1,500 systems</td></tr><tr><td>Improved water mill</td><td>4000 number</td></tr><tr><td>Improved Cooking Stoves</td><td>475,000 stoves</td></tr><tr><td>Biogas</td><td>130,000 household systems, 1,000 institutional and 200 community biogas plants</td></tr></tbody></table></li> <li>Nepal will maintain 40% of the total area of the country under forest cover and forest productivity and products will be increased through sustainable management of forests. Emphasis will equally be given to enhance carbon sequestration and forest carbon storage and improve forest governance.""</li> </ul>",1
"Overview","Non-GHG target","2030 unconditional mitigation targets: ""Reduced emissions from deforestation and forest degradation, foster conservation, sustainable management of forests, buffer zones of national parks and other preserves, and enhancement of forest carbon stocks; 13GW total hydropower capacity (domestic and export use) in the country; Introduction of 50,000 energy-efficient cookstoves; New Bus Rapid Transit system in Vientiane Capital and associated Non-Motorized Transport (NMT) component; Lao-China Railway.""<br>2030 conditional mitigation targets: ""Increased forest cover to 70% of land area (i.e. to 16.58 million hectares); solar and wind: 1 GW total installed capacity in the country; biomass: 300 MW total installed capacity in the country; 30% Electric Vehicles penetration for 2-wheelers and passengers' cars in national vehicles mix; Biofuels to meet 10% of transport fuels; 10% reduction of final energy consumption compared to business-as-usual scenario; 50,000 hectares adjusted water management practices in lowland rice cultivation; Implementation of 500 tons/day sustainable municipal solid waste management project.""<br>Please see Table 2, Table 4, and Annex 1 in the full text for details.",1
"Overview","Non-GHG target","“The government has set a target of generating 1700 MW from Utility scale solar plants and 250 MW from solar home system by 2030.”<br> “In transport sector, 10000 hybrid and electric vehicles are planned to be introduced, introduction of broad gauge and electric locomotives, introducing good quality fuel and Euro III and IV engines, completing all highways with four lanes, withdrawal of 86,000 unfit vehicles from the roads and introducing Lithium-ion battery in all motor cycles and cars are planned.”",1
"Overview","Non-GHG target","Chile commits to the sustainable management and recovery of 200,000 hectares of native forests, representing GHG captures of around 0.9 to 1.2 MtCO2eq annually by 2030.<br>Chile commits to afforest 200,000 hectares, of which at least 100,000 hectares will comprise permanent forest cover, with at least 70,000 hectares of native species.<br>By 2025, protect at least 20 coastal wetlands as new protected areas.<br>By 2030, protect at least 10 additional coastal wetlands as protected areas.<br>By 2030, protect at least 10% of under-represented marine eco-regions (Humboldt, Central Chile, Araucanía and Chiloe), in the framework of a participatory marine spatial planning, based on science and holding criteria to deal with the effects of climate change.<br>By 2030: 100% of marine protected areas created between 2020 and 2025 will have management or administration plans including actions for adaptation to climate change.<br>By 2030, 95% of Rural Health Systems will be inspected and registered, ensuring the quality standards of rural drinking water.<br>By 2030, 100% of companies in the health sector will have implemented disaster risk management plans, including consideration of risks resulting from climate change.<br>By 2030, non-treated sewage will be reduced by at least 25%.<br>By 2025: 100% of marine protected areas created up to 2020 will hold management or administration plans including actions for adaptation to climate change.<br>By 2025: Management or administration plans of at least 40% of the marine protected areas created before 2020 will be implemented at least through monitoring, control, community involvement and threat control programs.",1
"Overview","Non-GHG target","Energy Generation: ""By 2030, expand clean energy generation from approximately 1,400 MW to 15,000 MW, of which 5-10 % will be generated from mini and micro-hydro power, solar, wind and bio-energy. Of this, 5,000 MW is an unconditional target. The remainder is dependent upon the provision of funding by the international community; By 2030, ensure 15% of the total energy demand is supplied from clean energy sources.""<br>Transport: ""Sales of electric vehicles (e-vehicles) in 2025 will be 25% of all private passenger vehicles sales, including two-wheelers and 20% of all four-wheeler public passenger vehicle sales (this public passenger target does not take into account electric-rickshaws and electric-tempos) in 2025; By 2030, increase sales of e-vehicles to cover 90% of all private passenger vehicle sales, including two-wheelers and 60% of all four-wheeler public passenger vehicle sales (the public passenger target does not take into account electric-rickshaws and electric-tempos); By 2030, develop 200 km of the electric rail network to support public commuting and mass transportation of goods.""<br>Residential cooking and biogas: ""By 2030, ensure 25% of households use electric stoves as their primary mode of cooking; By 2025, install 500,000 improved cookstoves, specifically in rural areas; By 2025, install an additional 200,000 household biogas plants and 500 large scale biogas plants (institutional/industrial/municipal/community).""<br>Forestry: ""By 2030, maintain 45% of the total area of the country under forest cover (including other wooded land limited to less than 4%); By 2030, manage 50% of Tarai and Inner Tarai forests and 25% of middle hills and mountain forests sustainably, including through the use of funding from REDD+ initiatives.""<br>Waste: ""By 2025, 380 million litres/day of wastewater will be treated before being discharged, and 60,000 cubic meters/year of faecal sludge will be managed.""<br>Please refer to the ""Quantified targets of NDC"" and ""Detailed Description of Mitigation Component of NDC"" table in original text for more information.",1
"Overview","Non-GHG target","Energy Industries: ""Increasing from 30% (2015) to 78% the level of installed capacity for on grid electricity generation that is produced by renewables;""<br>LULUCF: ""a 25% reduction in both the area of annual deforestation and annual degradation against 2015 levels (equating to a reduction in annual deforestation of 8,300 ha or annual degradation of 43,300ha) as well as an increase in the area of forest planted.""",1
"Overview","Non-GHG target","Georgia has both GHG target and non-GHG sectoral targets mentioned. <br>“Georgia has identified the level of its greenhouse gas target limits by assessing the feasible targets for mitigation in each sector. To achieve the goal set out in NDC , following sectoral targets should be adopted as the goals of Georgia’s 2030 Climate Strategy and Action Plan:<ul><li>By 2030, Georgia plans to mitigate the GHG emissions from the transport sector by 15% from the reference level;</li><li>Georgia’s updated NDC supports the development of low carbon approaches in the building sector, including public and touristic buildings through encouraging the climate-goals oriented energy efficient technologies and services;</li><li>By 2030 Georgia plans to mitigate the GHG emissions from energy generation and transmission sector by 15% from the reference level;</li><li>Georgia’s updated NDC supports the low carbon development approaches of the agriculture sector through encouraging the climate smart agriculture and agritourism;</li><li>Georgia’s updated NDC supports the low carbon development of the industry sector through encouraging the climate-friendly innovative technologies and services, in order to achieve 5% of emission limitations comparing to emissions projected by the reference scenario;</li><li>Georgia’s updated NDC supports the low carbon development of the waste sector through encouraging the climate-friendly innovative technologies and services and through effective implementation of separation practice and principles of circular economy;</li><li>By 2030 Georgia intends to increase the carbon capturing capacity through the forestry sector by 10% compared to 2015 level;</li><li>Georgia’s updated NDC sets implementation period for Climate Change Strategy and Action Plan between 2021 and 2030 through identification of individual mitigation measures contributing to achievement of the sectoral goals.""</li></ul>",1
"Overview","Non-GHG target","In energy sector, Indonesia has embarked on a mixed energy use policy, with at least 23% coming from new and renewable energy by 2025.",1
"Overview","Non-GHG target","In the medium term (2030): <br>Energy: reduce energy intensity by a minimum of 20%, with an increase in national electricity production (which will be more than 75% from renewable sources) of 33% of electricity demand; 50% reduction of GHG emissions produced by transport; increasing the percentage of electric-powered vehicles of the national car park of passenger cars up to 20% by the year 2030. <br>Agriculture, forestry and land use sector:  it is expected to maintain at least the sink capacity of the country's forest mass in 2017, quantified in -139 Gg CO2 eq. annual. <br>Long-term commitment (2050): <br>Energy: The energy intensity will be reduced by a minimum of 30%, with an increase in national electricity production (which will be more than 85% from renewable sources) of 50% of electricity demand. More specifically, in the fuel combustion activities subsector, for road transport the reduction is not fixed in the long term, but it will continue with the increase in the percentage of electrically powered vehicles in the national car park of passenger cars to 50%. As for the building sector, any new construction is designed and executed to achieve a building with almost zero or positive energy consumption.<br>Agriculture, forestry and land use sector : around 23% of emissions are absorbed by the forest mass of the territory, so that an improvement in silvicultural management that incorporates nature-based solutions must allow not only the scenario foreseen in the medium term, that is to say, that at least the sink capacity of the country's forest mass of the year 2017 (quantified in -139 Gg CO2 eq. annual) will be maintained, but that the ambition regarding the sink capacity of the forests of the country.",1
"Overview","Non-GHG target","No high-level non-GHG target.<br>Some sectoral actions and targets: <br>""Efforts will be made to increase the installed the RE share to 15% of the energy mix, which includes the public and private sector.""<br>""The planned installation of 8 MW in Thilafushi and 1.5 MW in Addu City will be completed.""",1
"Overview","Non-GHG target","No top-line non-GHG target. See ""IV. Main areas of action"" for more details in the sectoral non-GHG targets.",1
"Overview","Non-GHG target","No top-line non-GHG target.<br>Other sectoral targets: <br>""50% share of clean energy (renewables and nuclear) in the installed power capacity mix by 2050"";<br>""The country has set a federal target to reduce energy consumption by 40% for the year 2050"";<br>""Dubai has set a target to retrofit 30,000 buildings in the Emirate by 2030. Ras Al Khaimah’s Retrofit Program aims to retrofit 3,000 buildings by 2040."";<br>""The Dubai Green Mobility Strategy targets a 2% share of electric and hybrid cars in Dubai’s road fleet by 2030, and a 30% share in Dubai’s government-procured vehicles by the same year."";<br>""The strategy’s objectives are to reduce potable water consumption by 20% and increase reuse of treated water to 95% by 2036.""",1
"Overview","Non-GHG target","No top-line non-GHG target.<br>Other sectoral targets: <br>""Brunei Darussalam aims to increase its forest reserves from 41% to 55%.""<br>""A further 400,000 trees are proposed leading up to 2035.""<br>""Increase total share of electric vehicles (EV) to 60% of the total annual vehicle sales by 2035.""<br>""Increase total share of renewable energy to at least 30% of total capacity in the power generation mix by 2035.""<br>""Reduce GHG emissions by at least 10% through better supply and demand management of electricity consumption by 2035.""<br>""Reduce municipal waste to landfills to 1kg/person/day by 2035.""",1
"Overview","Non-GHG target","No top-line non-GHG target.<br>See Annex A4 and Annex M1 for more detailed information on sectoral targets.",1
"Overview","Non-GHG target","No top-line non-GHG target.<br>Some sectoral actions and targets:<br>""Public transport will be gradually replaced to reach 0 CO2emissions by 2030.""<br>""Electric helicopters could be put into service by 2030 to provide regular Monaco - Nice (France) lines""",1
